text,categoryNumber,categoryMeaning,firstLevel,secondLevel
"It Wasn't Gas I Passed. The smell was in comparison to rotten eggs and the reason it is so memorable is because the source of the smell was coming from my mouth. I was in a small room full of people who assumed someone had released gas and was too embarrassed to fess up to the real source. Needless to say I called my mom to come and get me, and left as quickly as I could. I am sure they figured out the source once I was gone and it no longer smelled like that there.",cat8, Social interaction is affected by the smell,affecting,affected the social interaction/togetherness
"The Foul Litter box. Whenever I walked into my brother's apartment the smell hit me immediately. The entire living room was filled with the smell of urine and feces, and to a lesser extent the whole apartment. This smell emanated from the gigantic red litter pan sitting right beside the entranceway. Unfortunately, my brother's roommate had four adorable cats, but could never keep their litter pan clean. The smell deadened my senses and made me feel a bit dizzy. The urine was strong, and smelled like a noxious mix of chemicals. I smiled and tried not to gag. The cats were cute, but the stink was certainly not. I didn't mention it to him until later, because I knew that it was not his fault. I helped him drag in his belongings and tried to breathe through my mouth and not inhale. Eventually I had to, and I left the room in order to keep from retching. I still like cats, but I vow never to let my own cats' litter pan stink so terribly.",cat8, Social interaction is affected by the smell,affecting,affected the social interaction/togetherness
"I Can't Smell You. I, just tonight, had a coworker fart in my office before he left. After he left he came to my window and made a sniffing gesture as to ask if I smelled it yet. I acted like I didn't to keep him from having any satisfaction, but inside I was actually becoming quiet nauseated. I played it cool until he was gone and then I quickly ran for a bottle of air freshener. I sprayed the whole room down. The smell of his gas was the worse thing I have smelled in a long time; it really did just about make me puke.",cat8, Social interaction is affected by the smell,affecting,affected the social interaction/togetherness
Dragon Breath Teacher. Once a teacher yelled at me during class. She got so close up into my face that I could smell her bad breath. This made the experience much worse because I wanted to get up and walk away but she was grabbing me to keep me focused on her while she was talking.,cat8, Social interaction is affected by the smell,affecting,affected the social interaction/togetherness
The day I took a plunge. I was playing in a field with my friends when I tripped over a bush and fell into a pile of feces chest first. Instantly I could smell the pungent odor that escaped from it once I smashed it. It was smeared all over my chest and I was extremely embarrassed. I smelled terrible and the hot sun was only making me smell worse. This memory is still ingrained in my mind because of how humiliating it was.,cat8, Social interaction is affected by the smell,affecting,affected the social interaction/togetherness
"Eau d'Homeless (aka Why I Should Carry Febreze Around Everywher. I was riding the bus to work on what seemed like an ordinary, typical bus ride. I live in an urban area with a fair number of ragged looking homeless people that wander the streets night and day. At the next bus stop, a number of people got on and all of a sudden, I saw this really dirty looking homeless individual start walking down the aisle. You could smell the alcohol, the cigarettes, and the unmistakable musk of body odor wafting down the aisle several steps ahead of his physical presence. I was hoping and praying that he would not sit next to me, but he ended up plopping down right next to me for the rest of the bus ride. I wanted to gag and really felt like throwing up - the smell was that bad and no open window and fresh breeze could rectify such a stink. I decided to get off at the next stop and wait for the next bus, even though that would possibly make me a little late for work.",cat8, Social interaction is affected by the smell,affecting,affected the social interaction/togetherness
Stinky Pits. My daughter came into my room and flopped down next to me. She raised her arms and she didn't have deodorant on. Her arm pits stunk so bad. We laughed and I told her to put on some deodorant.,cat8, Social interaction is affected by the smell,affecting,affected the social interaction/togetherness
too much. I put on too much cologne when I was a kid.  It smelled strong for a long time and people noticed.,cat8, Social interaction is affected by the smell,affecting,affected the social interaction/togetherness
People. I attended a seminar in which I had to work in teams consisting of people from different nations.  I cannot forget the smell of the representatives from two countries in Asia.  It seemed like they haven't changed their clothes for several days. It made me want to puke but I have to behave professionally.,cat8, Social interaction is affected by the smell,affecting,affected the social interaction/togetherness
"Accidental compliments. I washed my clothes with Tide Sport and it has a very strong scent. I didn't know how much to use with my clothes so I used too much and they smelled really strongly of that smell, but I liked the smell alot because it smelled good to me, but to everyone else it was very strong. So I walked about campus alot and people would give me compliments on how good I smelled. Its memorable because I make stupid mistakes like that all the time and it was nice to not have negative consequences.",cat8, Social interaction is affected by the smell,affecting,affected the social interaction/togetherness
Positive licorice scent. I found out I like licorice flavor so i bought some anise oil to use for scenting. I used it as a body deodorant and someone remarked how they liked the smell that i had. Now i have positive feelings about any licorice scented objects,cat8, Social interaction is affected by the smell,affecting,affected the social interaction/togetherness
"Meat Fail. I walked into a meatshop, and the smell was pungent. It literally made me sick, and was such an overbearing scent that I became vegetarian.",cat9," Smell changes mood, attitude and behavior",changing,made me change my behaviour
B&C Incense. This was the last day of filming on the project.  We were in a large sound stage working with green screen.  I walked over to the video monitors to check something out and could smell the incense burning.  The musty odor always makes me sneeze so I walked away quickly.  After a while the scent started to overtake the table I was working out and the sneezing started.  I asked around to try to find out where it was coming from and why someone decided to burn it.  I had to leave my position for the rest of the day because I could not stop sneezing and it was affecting the filming.  I was devastated that I could not finish my job.,cat9," Smell changes mood, attitude and behavior",changing,made me change my behaviour
"The thousand dollar smell.. A few years ago we were shopping for a car for my spouse. We found one we really liked at a local dealer, and had to think about it before we tried to deal on it. But, the dealer had just recently had their parking lot resurfaced. Something about that fresh blacktop material really affected me. It was either the smell that I noticed with much more clarity than my spouse, or something in it that caused an allergic reaction. Whatever, I didn't want to have to deal with that experience again. We tried to get the dealer to work out some details about an offer over the phone, explaining that I couldn't stand to be in their newly resurfaced parking lot. They wouldn't deal that way, so we called around and found a dealer in a town some 70 miles away that had the same car. We bought it there.",cat9," Smell changes mood, attitude and behavior",changing,made me change my behaviour
"The Overwhelming Odor of Hops. I was pregnant with my daughter and passed by a restaurant that brews it's own beer. As I neared the restaurant I was overwhelmed with the smell of beer, not beer that's in a glass, but the hops that makes the beer. I'd passed by this same place for years and never had a problem. I had to cross the street to get as far away from the smell as possible.",cat9," Smell changes mood, attitude and behavior",changing,made me change my behaviour
"Pungent Supermarket Smell. I guess one of the most memorable smells that I can recall to date would be the smell of Fiesta supermarkets. Walking into the stores is like getting a bombardment of freshness, but not a good freshness. That is because the chemical they use to clean their stores smells like brand new disposable diapers. And the smell is not light so it is like getting bitch slapped with this pungent chemical smell. A complete turn off, one of the reasons that I do not shop there.",cat9," Smell changes mood, attitude and behavior",changing,made me change my behaviour
Cat Crap... Ohhh that smell!!!. I have three cats and taking care of their litter boxes is always an unpleasant job. A friend had purchased a bag of cat litter for soaking up an oil spill in her driveway and didn't need the rest of the bag so she brought it to me. It was a different brand than I usually use. I put it in the litter box the last time I scooped it and yesterday when I did my usual maintenance scooping I was surprised that the smell was not as strong as it had been in the past. Maybe it's time to switch brands.,cat9," Smell changes mood, attitude and behavior",changing,made me change my behaviour
"Saved by the Smell!. Among many things in my sexual-personal dating life, smell really impacted me. Although I'm only twenty, I found out quickly that smell is important to me. My ex-boyfriend and current boyfriend alike had rather pleasant smells to me. I remember in high school, I was complementing a boyfriend and met this boy that was nice and sweet. The only downside or so I thought was that the smell wasn't so pleasant to my nose. I hated it so much that it put a bad taste in my mouth. Whether that was... a mean choice or not to choose based off smell, I did it and didn't date the guy. Reflecting on it, I'm realllllly glad that I chose against dating the guy even if it was something so silly as smell. Not long after that I found out through a mutual friend and on the news that the guy had murdered his minor girlfriend's father just to stay with her and keep her because she was in earl stages of pregnancy. What a creep!",cat9," Smell changes mood, attitude and behavior",changing,made me change my behaviour
"Accidental vegetarian. I was pregnant, so I was very sensitive to smells at the time. On this particular occasion I was cooking ground beef. I was convinced that I could smell the blood cooking out of the meat and was unable to finish preparing it. I got so sick I had to leave my small apartment for a few hours. I didn't cook any type of meat for the remainder of my pregnancy.",cat9," Smell changes mood, attitude and behavior",changing,made me change my behaviour
"Pregnancy. When I was pregnant anything that smelled like raw meat made me sick. I could not touch it, handle it, or anything. I would get sick anywhere I went and could smell something that pertained to raw meat. Chicken, steak, fish, anything.",cat9," Smell changes mood, attitude and behavior",changing,made me change my behaviour
Smell of death. I remember the smell of a nursing home.  It was a very stale negative smell in my opinion.  Whenever I smell this smell I become extremely depressed and it reminds me of my great grandmother.  I often find myself sensing this smell at hospitals as well and it makes me extremely uneasy.,cat9," Smell changes mood, attitude and behavior",changing,made me change my mood
"The Aroma that Recollects an Antecedent Amigo (?). I have memories connected with the scent of Tresemme's Anti-Breakage shampoo. Many times when I smell it, I think of an old friend---who is no longer a friend---from high school to early college. He was my best friend, and I was at his house a lot. I became really close with his family. One day, while showering there, I used this shampoo, and for some reason, I really enjoyed the scent. Since then, I introduced it to my parents and they bought it when I was still living with them, and now I purchase it for myself and my fiancee in our apartment.  I don't think of my old friend every time I use it, since it's so frequent now, but on occasion, I still do---sometimes more often than others. The scent doesn't really conjure up good or bad memories initially, but it can trek to either eventually, depending upon where the initial memory is led.",cat9," Smell changes mood, attitude and behavior",changing,made me change my behaviour
"Bread in the oven. The first time I ever made my own bread was a revelation. I was unemployed, and it was something I had always wanted to try. No time like the present, and it would save some money as well. I love fresh bread.    The first time I made bread, the smell was transformative. The flour and yeast smells in the kitchen were fun, but a bit of time later, my apartment was filled with the smell of fresh bread. It was a smell I had loved since I was a kid, but had never had it as strong as when it was in my own kitchen and wafting through the rest of the house.    I was hooked. I began to love doing all the cooking at home, and that turned into a major turnaround in our family's health and budget. Eventually, with the birth of my son, we realized that I was actually more suited to being the stay-at-home parent, and my wife continued her career. All because of the smell of fresh bread.",cat9," Smell changes mood, attitude and behavior",changing,made me change my behaviour
Chipotle. The most memorable smell experience for me was walking into chipotle for the first time. The smell of delicious mexican food that day is what led me to keep coming back  every week with my friends,cat9," Smell changes mood, attitude and behavior",changing,made me change my behaviour
Smells of subway. One day i decided to go to subway for the first day ever. Although this was my first time going to subway it was about to become my favorite resturant becuase of the smell experience I had. As soon as i walked in I was hit with the smell of deliouious bread and food. The aroma was incredibly inciting and is the main reason that i visit subway almost daily now.,cat9," Smell changes mood, attitude and behavior",changing,made me change my behaviour
"Comforting sweater scent. My old grirfriend used to wash her clothes in Tide detergent, so they, especially her sweaters, had a particular smell on them when fresh.  Once after being gone for a couple weeks, and after a long, tense trip getting back home, I was welcomed by hug from her.  Somehow, the smell of her sweater is what I remembered most about that, as it instantly relaxed me and set me at ease after 12 hours of travel.",cat9," Smell changes mood, attitude and behavior",changing,made me change my mood
"White Lilac Sheets. My brother arrived at my home to help me move the bed from the guest room into the master bedroom.  He had to help me do that because my husband had taken our king size bed with him when he left earlier that day.  I actually helped him load the u-haul and hated myself for not letting him struggle.  The bed was moved easily, it was my old bed, the one I bought for myself when I left him.  It had a lovely and romantic brass headboard and seeing it in the room made me feel a bit better.  The walls had already been freshly painted.  I just needed to wash my sheets and make my bed and the room would be mine. Only mine.  I used my expensive white lilac laundry detergent to wash the sheets and covers.  When they came out of the dryer the sheets smelled like home and comfort.  I made the bed with my lilac sheets and the atmosphere changed.  I still remember that scent and how I felt on that day.  I was going to be okay.  The room didn't look or feel or smell lonely anymore.  It looked and smelled fresh and clean and lovely and a bit romantic and it was mine.",cat9," Smell changes mood, attitude and behavior",changing,has been used to change the mood
"The Road to Sous Chef. I remember the first day working in the kitchen at a sports bar. There was a combination of smells, all easily distinguishable. I remember distinctly being able to smell all sorts of pastas being sauteed, meats being seared, and pizzas cooking throughout the back of the restaurant. That experience really changed my perception of cooking and greatly strengthened my passion for food.",cat9," Smell changes mood, attitude and behavior",changing,changed my attitude
"bakery. The first time I walked into a bakery, I just knew that was what I wanted to do with my life. The smell was absolutely amazing and I knew that I wanted to be surrounded by it every single day. I rarely stop and think about the smell these days, so it doesn't quite have the same effect, but I still remember how strongly it made me feel.",cat9," Smell changes mood, attitude and behavior",changing,made me change my behaviour
"Beginning of winter coffee.. I absolutely love the smell of coffee. I remember one morning I had to go into work at 3:00 AM for Black Friday. I was exhausted, angry, and not wanting to go into work. I stopped by a coffee shop that morning. It was still dark out; middle of the night. It was the first unofficial day of the winter season. Walking into that coffee shop and smelling fresh brewed coffee along with peppermint mochas and white hot chocolates, just made me feel at peace. I was happy going into work just my smelling the aroma of the coffees of the season,",cat9," Smell changes mood, attitude and behavior",changing,made me change my mood
"Homemade Bread. Coming home from a bad day at school, when I walked into the house I could smell baking bread.  This wasn't an uncommon experience at the time, but it did make me feel much more calm and relaxed.  I was able to shift my mood to a more positive one and I've remembered that day since, even though it's been decades.",cat9," Smell changes mood, attitude and behavior",changing,made me change my mood
"Thanksgiving smells of childhood. I am one of 5 front of house managers at a nice restaurant. Last year, a week before Thanksgiving, one of our managers had a family emergency while another was on vacation. I ended up working four 15-hour workdays in a row as a result. On the last day, in the last hour I was there, exhausted and completely drained mentally and emotionally, our chef started prep work for the big Thanksgiving dinner service we were doing. My office is back near the prep kitchen, and suddenly it was full of the smells of roasting turkey, savory stuffing, basting hams...it was amazing, and reminded me of happy Thanksgivings of my childhood and the smells coming out of my mother's kitchen.  It was an incredibly comforting, cathartic, and altogether wonderful smell...I'll always associate it with the relief of finishing that grueling work period (and then the accompanying 4 days in a row off work).",cat9," Smell changes mood, attitude and behavior",changing,made me change my mood
"Get Home to a Wonderful Meal. I was having a really long day at work and am always hungry when I get home. I'm usually on the border between just hungry and cranky from hunger. I get home, walk through the door, and a wonderful smell hits my nose. It was a combination of fresh baked bread, a meaty aroma, and joy. Joy because after weeks of coming home in not the best mood, my boyfriend finally realized something he could do to make it better. Coming home to the smell of fresh dinner is much more inviting than the sound of the television.",cat9," Smell changes mood, attitude and behavior",changing,made me change my mood
Laughing with Cookies. I remember walking into our kitchen and seeing my mom scooping cookies out of a bowl onto to the pan. The smell of cookies baking always made me feel happy and always seemed to draw me into the kitchen to spend time with her (and lick the bowl)! I would be in another room of the house and begin to smell the sweet smell of chocolate chip cookies. It never failed to bring a smile to my face.,cat9," Smell changes mood, attitude and behavior",changing,made me change my mood
Airplane Odor. I hate to travel and one thing I hate about it is the smell of airplanes. I hate that they are stuffy and stale. They smell like really old coffee which I hate the smell of anyway and stale is the worst. They also smell like that mixed with a outhouse and some kind of spray mixed in to try and cover up the smell of the bathroom. All of that mixed together just makes my stomach roll. I feel sick the entire time I am on a airplane. It makes the entire experience seem to take that much longer and feeling sick for hours is no fun mixed with the odor makes it horrible.,cat1,Associating the past with a smell,connecting,linked to a location
"ER Odors and Funk. Entering an emergency room brings the intense smell of rubbing alcohol and the smell of a mop bucket where the floor just go mopped after someone got sick. It's a very memorable experience and ... so, usually when I smell rubbing alchohol or even pine sol - the memory of emergency room visits lingers.",cat1,Associating the past with a smell,connecting,linked to a location
"Frosting Donuts. The smell of a donut shop, or donuts in general bring to mind memories of when my parents owned a bakery.  I was 12-14 years old.  They made me work in the bakery after school frosting donuts.  It was awful.  The job itself wasn't bad, but the other employees made me uncomfortable.  And after a few minutes inside the bakery the donuts stop smelling delicious.  They take on this sickeningly sweet yeasty smell.  And  after working there for more than a half an hour, the smell starts permeating into your clothes and hair.  Even to this day, donuts are very unappealing to me because it brings back those feelings of loss of freedom, not feeling safe (older men working there made me feel unsafe), and overall unhappiness.",cat1,Associating the past with a smell,connecting,linked to a negative event/episode
"The smell of an Ex. My scent memory has to do with a cologne worn by an ex boy friend, we had been friends for a while and I came to associate this specific scent with him. Things in our relationship did not end well, one might even say very badly. Weeks maybe even months later is when I first encountered this cologne being worn by someone else. Instantly I associated the smell with my ex and all the feelings from our messy break up came flooding back all at once. Even now, years later, I am completely over what happened between us but if I smell that cologne it still brings back the way I felt the first time I smelled it after our breakup.",cat1,Associating the past with a smell,connecting,linked to a negative event/episode
Redbull. Everytime I smell red bull I think of drinking shots and red bulls and vodka. I can't even drink red bull because it makes me feel bad. I don't like the smell of it.,cat1,Associating the past with a smell,connecting,linked to a negative event/episode
"No curry for you!. The smell of rotting Indian food, while working in a food service on campus, the Indian Student Club was working on a dinner, they cooked off curry chicken and put it in a hot box, then put it in the cooler to cool it down. Sadly the food stayed hot all night and the smell when they opened the door the next day will forever be burnt into my nostirls",cat1,Associating the past with a smell,connecting,linked to a negative event/episode
"Gramma. When my gramma was dying she had sores on her. They were really bad, and they had this smell to them. It was like rotting flesh. (come to find out it actually was rotting flesh, she was unable to move at all and she had really, really bad bedsores.) She smelled so much like it, that it scared us. It smelled like death. Sometimes you'd catch a whiff of it days months, and even years later. It was probably all mental but I still smelled it sometimes.",cat1,Associating the past with a smell,connecting,linked to a negative life event
"Dead Body. The first time that I smelled a decaying body is unfortunately the most memorable. I had smelled rotting animals before, but knowing that it came from a human corpse was revolting and depressing. I was in Honduras at the time, and we found her on the side of the road. She had been hit by a car and left to die. It make me sick, and I found it hard to sleep for several days.",cat1,Associating the past with a smell,connecting,linked to a negative life event
"The End of his life , beginning of flowers.. The experience i have involving smell is a sad experience and memory. The smell experience i have involves the strong smell of flowers. My grandfather passed away about 6 months ago , i was very close to him as was much of my family and community. I will never in my life forget the smell of all the floral arrangements around us when we approached him for the first time at the wake.Everytime i smell flowers in large amounts at a store, garden, garden center , wedding anywhere all of my memories from his wake come back to me . Its hard and upsetting and still somthing im dealing with.",cat1,Associating the past with a smell,connecting,linked to a negative life event
