text,categoryNumber,categoryMeaning,firstLevel,secondLevel
Hollister. I remember walking into Hollister in the mall and being overwhelmed by the scent of a mans cologne. It was a good smell just very overbearing. It was memorable because I can never remember having such a strong smell come over me.,cat3, Smell perceived as stimulating,pleasing,first time perfume scent
"Chrome: The Christmas Cologne. About five years ago, I received a cologne called Chrome as a Christmas present from my brother. This cologne has somewhat of a citrus like odor which is very pleasing. The smell of the cologne, along with the usual Christmas time smells around the house (food, spices, candles, etc.) was very invigorating. To this day, the smell of Chrome gives me a nostalgic sense of peace and joy every time I put it on. Because so, I try only to wear it during the holidays.",cat3, Smell perceived as stimulating,pleasing,sourced by a perfume
"Discovering Huneysuckles. I remember discovering honeysuckles for the first time.  My family and I had just moved to a new house before my 6th birthday.  I remember walking with my mother into the backyard and I smelled the sweetest smell in the world.  It was like a clean, sweet smell, not a refined smell that we often associate sweet smells with.  I remember looking around and not knowing where the smell was coming from.  I realized that it was coming from the front corner of the backyard.  I didn't try a honey suckle that day, but I remember it catching my full and undivided attention when they warm breeze blew the smell of honeysuckle my way.",cat3, Smell perceived as stimulating,pleasing,due to first time natural scent
"purple cotton. I live in a state that has medical marijuana and buying it sometimes can be odorous in a good way. One of my favorites to buy was a strain called  purple cotton , its smell permeated heavily. I still remember the way it smelled.  It smelled a little like a skunk but in a good way.",cat3, Smell perceived as stimulating,pleasing,sourced by nature
"The Rain. Last weekend I cut the grass late in the evening on Saturday.  Sunday morning, I was up early, and reading the paper on the front porch.  I could still smell the grass which had been cut.  A great smell, once of peace and contentment.  One of freshness.  A smell that is as old as I am.  Then, as I was reading, I smelled something different. The smell of rain!  Rain was coming, and it did within just a moment.  Two wonderful smells, intermingled.  It was fantastic, and I was so happy and so pleased as I sat there watching the soft rain fall, enjoying the smell of the rain with just a hint of the freshly cut grass underneath it.",cat3, Smell perceived as stimulating,pleasing,sourced by nature
"Mom's Crab cakes. My one memorable smell experience was the first time my Mom made her amazing home made crab cakes. I had just come home from swim practice and as I walked through the door, the aroma of seafood, the ocean, and that famous old bay spice hit me all at once. I couldnt contain myself and yelled Mom, what is that?? She replied, I'm just making crab cakes! As I approached the kitchen, I could practically taste the sweet salts of the ocean through my nose and the richness of the crab meat smell mixed with the fresh spice of Old Bay seasoning was amazing and memorable.",cat3, Smell perceived as stimulating,pleasing,due to first time food
bakery delights. I was walking down a street in new york and I passed by a bakery and loved the smell of the delicious treats inside.,cat3, Smell perceived as stimulating,pleasing,sourced by food
Waking To The The Aroma Of Fresh Brewed Coffee. I woke up Sunday morning to the wonderful smell of freshly brewed coffee. I drink coffee every morning but this morning my hubby was home and made some for me before I woke up. I felt happy and spoiled.,cat3, Smell perceived as stimulating,pleasing,sourced by food
"Cafe Biscotti. When I was a kid my mom would take me shopping at one of the malls in my hometown.  In the mall there was a coffee shop.  She would always buy herself a coffee and, since i was too young for coffee, I would get a chocolate chip biscotti. The smell of the place was just strong of coffee and chocolate from the mochas, as most coffee shops are.  The difference being that I always had the added smell of the biscotti which smelled of cooked dough and chocolate.",cat3, Smell perceived as stimulating,pleasing,sourced by food
Slice of Heaven. I walked into an italian restaurant once and was instantly surrounded by pleasant herbal scents. The smell of roasted tomato sauce and baked cheese and fresh oregano and basil filled my nostrils. The smell of large Italian meatballs was also prominent.,cat3, Smell perceived as stimulating,pleasing,sourced by food
"The Smell of Cologne. The memorable smell experience that comes to mind for me would have to be walking into our local store and trying out different brands of cologne in order to find one that fit me just right. The sniff is almost indescribable because they smell so addicting that it's more of a  you have to be there  type feeling, but what helps is that it's your nose's first time smelling any of them, thus the aroma overwhelms you and draws you closer and closer. As you use it more and more, the smell still sticks around, but not as prevalent as that first time when you're spraying it on your wrist to test it out. The one I prefer the most is called  Raw Power  and it really takes your breath away with how hypnotically incredible the smell is that first time.",cat3, Smell perceived as stimulating,pleasing,first time perfume scent
"How Haberdasher and Spanish Dancing Brought Me to Manhood. I remember smelling the perfume of a girl in high school---Haberdasher was the perfume's name, and Janine was hers. We were Spanish dancing partners, so I learned to love the smell of that perfume.",cat3, Smell perceived as stimulating,pleasing,sourced by a perfume
"A Fragrant Memorization. Last year as my husband split firewood and I stacked it I came across a piece of cedar wood. I could smell it in the armload of wood I carried and became excited. The smell was fresh and pleasant, it brought back memories of when I was younger and the cedar chest that my father owned. I couldn't wait to put away laundry in his room so that I could inhale deeply the rich fragrance.",cat3, Smell perceived as stimulating,pleasing,sourced by a perfume
"Girls who smell like candy. I remember when girls used to wear this candy smelling perfume all the time, i think it must have been a trendy perfume at the time or something. Im not sure why but i really really LOVED it when girls wore that. its the only perfume i've ever smelled that made me think a girl who i normally wouldn't think is attractive was then",cat3, Smell perceived as stimulating,pleasing,sourced by a perfume
"J'adore Perfume. When my boyfriend gave me a perfume as a gift, I fell in love. It smelled incredible. It smelled a bit like floral but mostly it had a fresh scent. It is the best perfume I have ever smelled.",cat3, Smell perceived as stimulating,pleasing,sourced by a perfume
"Positive first Impression. I walked into a department store tried on a fragrance of perfume. I fell in love with the scent. It was a pleasing sent. It made me feel beautiful, fresh feeling and wonderful. It made me feel good about my surroundings.",cat3, Smell perceived as stimulating,pleasing,sourced by a perfume
"New scent for Hawaii. I remember when I took a trip to Hawaii and had purchased a new deodorant to use on the trip. It was a type I had not used before because I had a free coupon for it. I did not use the deodorant until I arrived in Hawaii so I had not smelled it. Upon my first use, I realized it had a very fresh smell, almost like flowers but not that sweet. I didn't think much about it. Later when I returned home, I finished the stick of deodorant and went back to my usual brand. A year or so later, I received another coupon for that type deodorant. I purchased it again and upon opening it for the first use, the scent took me immediately back to my Hawaiian vacation. It was surprising and wonderful. Now everytime I smell it I'm transported back to Hawaii.",cat2, Remembering through a smell,remembering,makes me remember a location
"injustice revisited. walking into my nephews elementery school.. the smell sent me back to my own grade school experiences, which were not happy",cat2, Remembering through a smell,remembering,made me remember childhood
kindergarten  jelly smell. in kindergarten the cafeteria where we had to wait for school to begin always had a strange jelly like smell. sometimes when i take my children to school i smell it and it reminds me of being a kid,cat2, Remembering through a smell,remembering,made me remember childhood
"Elementary Glue. While shopping recently, I walked passed an aisle with craft and school supplies. The smell of Elmer's paste filled the air and that smell always instantly reminds me of my kindergarten classroom. It reminds me of simpler times and is a positive smell in my opinion.",cat2, Remembering through a smell,remembering,made me remember childhood
"Revisiting the Museum. One of my most memorable moments of a smell experience was when I revisited a museum that I used to attend frequently as a child.  We returned to the town where I had lived as a toddler when I was around 14. As soon as we entered the museum, the smell of it brought back intense memories of having visited there as a child.  While I didn't remember many of the details of the museum itself, the smell brought back the feelings of joy that I had as a child when I visited there with my mom.  The smell itself is difficult to remember and describe-- I do remember it smelling like a library, which is another of my favorite smells.",cat2, Remembering through a smell,remembering,made me remember childhood
Rainy smell. When it started raining and it reminded me of my old hometown in Corona.,cat2, Remembering through a smell,remembering,makes me remember a location
"The Timeshare. My grandparents have a timeshare on the beach and it was my favorite place to go as a child. The timeshare appeared to have been built in the 1960s and had not been updated since. As such, the unit where my grandparents stayed smelled like salty beach air and had a slight scent of old cigarettes, which sounds unpleasant. However, it smelled great to me, and now if I'm at the beach and catch just a hint of cigarette smoke it really brings me back to that timeshare.",cat2, Remembering through a smell,remembering,makes me remember a location
"moms perfume. I was with my friend in a department store, when I smelled something familiar.  The smell was of a perfume my mother wore when I was a child.  I didn't know what sort of perfume it was , or even if the smell I was smelling in the department store came from flowers or a perfume.  This was significant because my mother died when I was 8 years old.  I remembered this smell, and it reminded me of my mom.",cat2, Remembering through a smell,remembering,make me remember a person
"Hidden Memories. I like to get all the free samples of hair care products that I can because the ones that I buy end up being used as bubble bath. One day I got into the shower and started washing my hair. As I was lathering the shampoo, the scent of the shampoo reminded me of my grandma who died a few years ago from ALS. It was a minty sweet perfumey smell. I miss her so much. It was a great thing. I felt I had no other choice really but to buy this shampoo and conditioner and now I get a wiff of the great smell. Plus my hair is  really soft. Its a win win.",cat2, Remembering through a smell,remembering,make me remember a person
"Grandmas perfume. One smell I can recall is that of my late grandmother. As a child I love smelling the sweet floral lily/ lilac of her perfume and remember resting my head against her shoulder. A few years back, I came across a scent or sale that immediately took me back to that moment and purchased he lotion, as it was a limited edition. Every now and then I sniff it and instantly recall my grandmother.",cat2, Remembering through a smell,remembering,make me remember a person
"Pizza. Working at a pizza shop I remember the small of pizza every day. It was a comforting smell, the place was a high quality place, so it wasnt like it was a gross smell. It reminded me of college.",cat2, Remembering through a smell,remembering,make me remember old times (teenager/college)
"Christmas Perfume. I go perfume from my boyfriend & my son for Christmas. It was called Pink Sugar. It smelled very sweet. It is expensive, about $60 for a small bottle, so I don't buy it often. I spray it on and it reminds me of old & new memories. I wore it in high school, so reminds me of a time when I was younger, and now it reminds me of my son and boyfriend when I put it on also.",cat2, Remembering through a smell,remembering,make me remember old times (teenager/college)
Recollecting Memories of a Childhood. I was recently at the store and I smelled a lotion and it completely brought me back to my childhood. I had a lotion that smelled exactly like that when I was younger and tons of memories came flooding back. It reminded me of when I collected lotions and barbies and beanie babies and pokemon cards. It made me feel good to remember this memory.,cat2, Remembering through a smell,remembering,made me remember childhood
"Lilac Memories. The smell of lilac flowers is particularly memorable for me. I was driving down the street one spring day when I was met with the smell of lilacs. It took me back to my 4th year of school when I had a hopeless crush on a girl named Donna. She wore some kind of fragrance (I know, unusual for a 4th grader!) that reminded me strongly of lilacs. Ever since that day I was driving and caught their scent, the smell of lilacs takes me back to that time in my life.",cat2, Remembering through a smell,remembering,made me remember childhood
"Highland Park Lilacs. When i was a kid my family used to go to a park in New York state--where we lived then--that was filled with lilacs.  Packed with them.  Hundreds of lilac trees and every spring they would all bloom and the smell was incredible.  People would come from all over to see and smell that.  Now I live in CA and there are no lilacs here really, they don't grow here, the climate is different.  But a few weeks ago I was in a store that had lilacs--I hadn't smelled them for years and hadn't thought about Highland park in even more years--but as soon as I smelled them it all came back to me.  I even imagined myself as being young and short and the trees towering over me.",cat2, Remembering through a smell,remembering,made me remember childhood
"Reliving Childhood. My sister gave me a body wash from Bath & Body Works for Christmas. It is called Country Chic. The first time I used it I was taken back to my childhood. It reminded me so much of my childhood. I couldn't recall the particular part of childhood it reminded me of, nor can I still. However, the smell of it just almost overwhelmed me. I ended up buying the perfume, lotion, and body spray just because I loved it so much.",cat2, Remembering through a smell,remembering,made me remember childhood
"The sweet smell of Florida. When I was younger, about 7 years ago, my family and I lived in Florida for quite some time, and I always wore a certain body spray from Victoria's Secret. I just would carelessly spray myself with it every time I saw it or thought about it. My time in Florida was mostly spent developing wonderful friends and relationships with school, sports, and home games. I always had that spray on. Eventually, I just stopped wearing the spray, I had moved onto one I liked better. Not too long ago, i visited my grandmother and she had the exact same spray in her bathroom, I thought I'd put it on. As soon as I pressed the pump, and smelled the sweet sandalwood, every emotion  and memory from Florida rushed back to me.",cat2, Remembering through a smell,remembering,made me remember childhood
"I smell something I can never forget. After my grandmother passed away, one thing I knew I would always miss was how she smelt. A few weeks later, I was back home in Oregon and was working outside in the garden. Thats when it hit me, I smelt her perfume. Nobody was around, and it was a beautiful sunny day with a small breeze. This made me sad but so happy at the same time. It brought back many memories and I had to take a moment and just breathe her in. It lasted for what felt like forever, but just a few minutes.",cat2, Remembering through a smell,remembering,triggered a flashback
"Memories Abroad. I bought a hair detangling product at a regular drug store. I had never used it before and when I first sprayed it, the smell filled my nose and reminded me of something instantly. I couldn't place it at first and it bothered me because it was so familiar. I used it and brushed my hair, which kept the smell fresh in the air. Then it suddenly hit me that it was the same scent at the lotion my host mother had used when I studied abroad 4 years earlier. Once the memory surfaced and I could place the smell, many memories of my time abroad came to mind. My host mother isn't a person I think of often (4 years earlier) but the simple floral scent evoked emotion and nostalgia. It was very pleasant.",cat2, Remembering through a smell,remembering,triggered a flashback
"Hand Lotion Time Machine. I was putting lotion on my hands the other day. It was the brand of lotion that my grandmother wore. As I applied the lotion and rubbed my hands together, I got a whiff of the scent and suddenly I was transported in my imagination to my grandmother's bathroom where she kept her Jergen's lotion on a shelf. I could see the bottle and the green tile in her bathroom, and her towel rack and shelf where the lotion was kept. I imagined that I could hear her voice talking to me as she rubbed lotion into her hands. As I opened my eyes I had tears streaking down my cheeks, as my grandmother passed away and I am still sad about losing her.",cat2, Remembering through a smell,remembering,triggered a flashback
"My Little Pony Doll. I had a scented little pony doll as a child. I loved the way it smelled. I think it was a cherry flavor, I'm not sure, but it didn't smell like cherries. I hadn't thought of it in years, until I bought a package of scratch and sniff stickers and one of them smelled exactly like it. The memory of that little pony flooded back to me, it was so vivid. I could feel its main in my memory and the rough, rubbery plastic it was made out of.",cat2, Remembering through a smell,remembering,triggered a flashback
"Grandmother's cookies. Around Christmastime, my mother bakes cookies. This year she baked special cookies; my grandmother passed away a few months earlier, so my mom made my grandmothers signature raspberry thumbprint cookies. Their smell made me a little sad because I missed my grandmother, but also happy because it reminded me of my childhood.",cat2, Remembering through a smell,remembering,make me remember a person
Sweet Cookie Scent. I remember my mother baking cookies growing up and even now as an adult. The smell was so warming a sweet. Every time I smell fresh baked cookies I think of my mothers special touch in chocolate chip cookies or delicious peanut butter cookies. Anything and everything she ever made was so sweet and delicious.,cat2, Remembering through a smell,remembering,make me remember a person
"Mom's Pumpkin Pie. My mom always makes pumpkin pie from scratch for Thanksgiving.  I can remember waking up as a kid and smelling the sweet and spicy aroma of the pumpkin filling and looking forward to a delicious meal with my family.  Whenever I smell pumpkin pie now, many years later, I think of Mom, standing in the kitchen wearing her apron, looking into the over to make sure that the pie is cooked to perfection.",cat2, Remembering through a smell,remembering,make me remember a person
"The Smells of Target. My biggest smell experience/memory is the smell of going to Target with my mom and sister as a child/teenager. I used to love going to look around Target with my family, even if we didn't buy a thing. I just loved spending the quality time with them. It made me feel like my mom really loved spending time with me too. The  smell of Target  that I'm referring to is the smell of popcorn and other food. More recently, since more Targets have a Starbucks in them, it includes the smell of coffee. We would walk around the store for a while and then, on the way home, stop at Taco Bell to eat, where we always had lots of laughs. I actually work at Target now, and I love the smell of when the store is about to open because it makes me think of those fun times with my mom.",cat2, Remembering through a smell,remembering,make me remember old times (teenager/college)
"My Playhouse. My father built a playhouse for me years ago, and about a year ago, I revisited this playhouse. It still had the same smell that I remembered as a child. The smell of my toys, the smell of the wood and paint used to build the playhosue,the smell of the blue carpet, and the smell of the attic of the playhouse. The smell was pleasant because it immediately brought back memories of my childhood. It was a bittersweet moment.",cat2, Remembering through a smell,remembering,made me remember childhood
"76. the smell of linden and honeysuckle coming from fairmount park, as i drive home along i-76. it reminds me of home, of summer, of good nights with family and friends, and always makes me feel at ease.",cat2, Remembering through a smell,remembering,made me remember childhood
"Hay. I was at the zoo with my sister, wife, son and nephews when we walked into a giraffe exhibit. Part of the exhibit was in an inside enclosure that smelled very strongly of hay. The scent immediately took me back to when I was a kid and would spend the weekends at my grandfather's house. He was a cattle farmer and had horses and the smell of hay always makes me think of his house and the weekends I spend there.",cat2, Remembering through a smell,remembering,made me remember childhood
grass. when i smell grass on a baseball field it takes me back to when i was a kid playing baseball.  its relaxing and reminds me of my father and all the great times we once had.,cat2, Remembering through a smell,remembering,made me remember childhood
The Bakery. I lived in Brooklyn New York until the age of 7.  My Dad and I used to drop my mom to work in Manhattan.  Every time we come home we would stop at a Caribbean bakery and buy Cassava Pone.  When you get out of the car in the parking lot you could smell the pone from the car.  Every time I smell pone I think of bonding with my Dad and New York.,cat2, Remembering through a smell,remembering,made me remember childhood
"Lasagna. My memorable smell experience happened when I was in college. I came home for the weekend, and my mother was making lasagna. Lasagna, especially my mom's, is my favorite food.  When I opened the door to the house, I could smell the lasagna cooking, and I had a flood of emotions. I suddenly felt like I was a little kid again, feeling happy, carefree.",cat2, Remembering through a smell,remembering,made me remember childhood
"Mom's Wonton Soup. My mom loves to cook, and she particularly loves to cook for her family. When I left home one of the things I missed most was my mom's food. When I returned home for my birthday last May the first dish I requested was my mom's wonton soup. My mom mixes the filling which smells like soy and green onion, a delicious coforting smell. The soup broth smells similar to the filling along with a rich chicken broth scent. It's a warm rich comforting smell that reminds me of home and how much my mom loves me.",cat2, Remembering through a smell,remembering,made me remember childhood
"The Smell of Christmas. Christmas time when i was a kid. Our decorations always had a smell about them. and when we would open the boxes they were stored in to start decorating, the whole room would be filled with that smell. it's hard to define what exactly it smells like. i just describe it as smelling like Christams. Cinimon, pine needles, and something else. every year we would unpack them and they would always smell that way. then we put them in storage, moved and we haven't had them around since. until a couple years ago we found a box of them, and all we could take were our christmas stockings. and the first thing i did when we pulled them out of the box was smell them. and they smelt just like my childhood. just like christmas. i nearly cried.",cat2, Remembering through a smell,remembering,made me remember childhood
"Flashbacks. One way I really notice the difference in the United States and China is by how the air smells. I'm not talking about the difference in pollution levels, or car exhaust or anything like that (although those are big differences). What strikes me, however, is that in China, they use different brands of cleaners. Office buildings and restaurants smell different - not bad, just different. Bathrooms in china will smell differently because they use a different deordorant. I was back in the States one summer eating with friends at a Chinese restaurant. They must have imported their cleaners from China or gotten it at an Asian SUpermarket, but when I walked into their bathroom to wash my hand, I was so struck by the smell, and thought I was in Asia for a brief moment.",cat2, Remembering through a smell,remembering,triggered a flashback
Good smell. I caught the smell of something that brought me back to my childhood. It was just the smell of a food that I hadn't had since I was young.,cat2, Remembering through a smell,remembering,triggered a flashback
