text,categoryNumber,categoryMeaning,firstLevel,secondLevel
"Sugar Beet Factory Memories. When I was a child (8-12 years of age) I lived in the north side of Nampa Idaho.  During this time I have the best memories of my life.  About 3 miles away was the Sugar Beet Factory.  Each year in the fall the sugar beets were delivered and put through the process.  I don't know the process, but the smell that came out of the factory was something very close to burnt Peanut Butter.  Now, most people HATE that smell, in fact many business have complained about it over the years, but I LOVE it, it is memories for me.  Memories of football playoffs and the times when I played football in the back yard with the leaves falling from the large oak tree in our back yard.  Memories of riding my bike through the nearby cemetery in the cold.  Memories of listening to CBS Radio Mystery Theater on the radio.  Memories of my mother's home made meals.  Memories of the best times of my life.  I am now 45 years old, however I still live in Nampa, not north Nampa but I pass by it regularly on the freeway.  This sugar beet factory smell triggers those memories every time.  I treasure the smell because of the great memories it brings back, I hope they never close that factory, those were the best times!",cat1,Associating the past with a smell,connecting,linked to a positive event/episode
"Going down, far from a frown!. The most memorable smell experience I have ever had was when I was going down on my girlfriend for the first time. The smell was intoxicating and pleasant. It was a very natural and sweet smell that compares to nothing else I have ever smelled. If i had to give a word to a smell: Juicy is one that comes to mind. Still thinking back to this day brings back very fond memories.",cat1,Associating the past with a smell,connecting,linked to a positive life event
"Hearty Marinara vs Regular Pizza Sauce: How I Tell The Differen. I used to work for Domino's and there are a few different sauces we can put on pizzas.  The Hearty Marinara and regular pizza sauces look kind of the same (the former is a bit more chunky if I remember right), but they smell different.  The Marinara has a smell that I actively dislike, while I'm good with the regular sauce.  One night, we were busy, making lots of pizzas, when two identical pizzas came out of the oven, one with the Marinara and one with the regular sauce.  The driver didn't know how to tell them apart, so I came over and smelled them and pointed at the one who's smell was not good and told him that was the one with the Marinara.  So, because of the fact that I don't actually like that sauce, it makes it easier for me to tell pizzas with identical toppings apart if one has that sauce and the other does not, so that the customers can get the product they ordered rather than have a mix-up occur.  I did that more than once, too, by telling identically topped pizzas apart by the sauce smell.  It made me proud that I actually had some use beside being good on the phones and gave my disliking of the Marinara a good point!",cat5, Smell allowing identification and detection,enabling,helped me to identify it
"Don't forget to check your gas stove before you leave the house. When I was in college. I had an apartment with a gas stove. One day when I came home, as soon as I walked through the door, I could smell that the whole place was full of gas because I had accidentally left the stove on. I was pretty scared at the time, but luckily nothing bad ended up happening.",cat5, Smell allowing identification and detection,enabling,helped me to detect something
Stinky Diaper. I smelled my son's butt to see if he has poop in his diaper.  It was really stinky!  I can't help but still remember how it smelled.,cat5, Smell allowing identification and detection,enabling,helped me to detect something
"No candles!. One of the most memorable smell experiences I've ever had involved walking in to a candle shop in the mall. I often refuse to go in to them because the smells can cause me to have allergies, but I braved the storm so that my girlfriend could look around. For me, there always appears to be a certain smell in candles and fragrances that immediately upon smelling I can identify as something that will cause allergy issues for me. It's a pungent smell that excites my nose in all the wrong ways. The smell almost feels like the start of a sneeze. Unfortunately, often those smells will cause allergy issues that can persist for hours. In this instance, my generosity caused me to be miserable for the rest of the venture.",cat5, Smell allowing identification and detection,enabling,helped me to identify it
"the smell in the NICU. My son was born 6 wees early, so had to spend some time in the NICU.  I was discharged from the hospital after a day and a half, but he was in for another 12 days.  I would go visit him (change him, nurse him, cuddle him) at least twice a day, every day.  Maybe it was just an association with the smell of  hospital , but I swear the postpartum hormones were so strong that I could smell him from the moment I walked in the doors.  I used to joke with my husband that I could be led into the NICU blindfolded and find my baby on the first go.  Unfortunately, he wouldn't let me put that theory to the test ;-)",cat5, Smell allowing identification and detection,enabling,helped me to identify it
"Propane smell. Yesterday while I was cleaning and scraping the propane BBQ grill outside, I noticed a very strong scent of propane. I had been cleaning for about 10 minutes when the scent caught up to me. The propane had never been shut off correctly and had been leaking slowly for a couple hours. The smell was unmistakable.",cat5, Smell allowing identification and detection,enabling,helped me to detect something
"Gas Leak. I was cooking something on a gas stove and went out for a few minutes. When I came back, the fire was extinguished but the gas was still on. My roomate was sat at the table doing schoolwork, completely oblivious to the poisonous gas that was filling the room. I told him to get the hell up and open the windows and doors. Then I fanned the gas out with the door.",cat5, Smell allowing identification and detection,enabling,helped me to detect something
"If something smells like gas, it probably is!. For several months, I kept smelling what I thought was gas. We had a gas oven at the time, so it wasn't surprising, but it also wasn't normal. Of course, I wasn't raised around gas appliances, so I wasn't really familiar with what could happen if an appliance like that was leaking. Regardless, it freaked me out. We eventually discovered that the pilot light had gone out. Fortunately, nothing bad wound up happening because of it. I felt exceptionally grateful that we hadn't blown ourselves up!",cat5, Smell allowing identification and detection,enabling,helped me to detect something
"Perfume. I use to wear the same perfume all through high school.  One day, many years after I graduated, I was walking through the mall and smelled the same perfume.  I thought they had stopped making it.  I was so pleasantly surprised to find it again.",cat5, Smell allowing identification and detection,enabling,helped me to identify it
"Soap Experiment 101. When I was a freshman in high school some 25 years ago, we were doing this experiment in science class that involved the use of dish soap. I remember I had identified the brand of dish soap on smell alone - there were no bottles of the soap visible as they were placed in smaller containers to be readily used for the experiment. I had commented to my teacher that it was the particular brand that it was, and he seemed impressed that I was right and had identified it by smell alone. I remember feeling very smart at the time and a little bit special that my teacher was so impressed. I couldn't tell you what the experiment was, or how the soap was involved, but I can still remember the brand of soap used.",cat5, Smell allowing identification and detection,enabling,helped me to identify it
"Pizza My Heart. There was this pizza place I was recommended to by my friends.  I decided to venture there one day since I was in the area and it was convenient.  I had to use my phone to try to find it and was on my way.  As I was walking, I was hit by an amazing smell and I realized it was the pizza place.  I ended up just following the smell and looking around as the smell was so amazing that it led me to the place.  When I went in, I was amazed at how great the pizza smelled and I hoped the pizza smelled as great as it was.  The experience was memorable to me because it ended up becoming one of my favorite pizza places.  I had a memorable first experience with it and love to go back to this place.",cat5, Smell allowing identification and detection,enabling,helped me to identify it
"Really--A Skunk?. I remember the first time I smelled a skunk. Honestly, I can't understand why skunks have a reputation for such foul odors. I agree that the smell was unpleasant, but it wasn't exactly gag-inducing. It reminded me more of burning rubber, but not the type of burning rubber you would associate with tires. This was much more subtle, and it even had a hint of dawn air about it (the skunks around here seem to be nocturnal creatures).",cat10, Smell builds up and changes expectations,expecting,surprised me
"For a T-shirt?. Last thanksgiving  I had met up with some hometown friends at a bar. We had a few beers, when the bright idea of doing the bars Hot wing challenge hit me. Had to get my name on the wall right? Eight hot wings, 8  minutes, and then 5 minutes without any food or water. It was all set. They place the wings in front of me and the smell of the ghost pepper sauce put tears in my eyes. Fear set in, and everyone knew it was going to be bad. The smell wreaked of all the things you know you have t drown in ranch dressing just to choke down. The smell was but a mere warning for the taste, which left me crying for over an hour. Granted, in the end, i did get a tshirt and my name on the wall, so Im the real winner here.",cat10, Smell builds up and changes expectations,expecting,builds up expectations
"PomVinegar Surprise. I once went to a high-end restaurant and tried out its house salad. I believe the dressing was a somewhat sour brand of pomegranate vinegar, along with parmesan cheese or something similar. As the salad arrived, I could smell the pomegranate and vinegar from about 10 steps away, and it was a very pungent (thought not unpleasant) odor. I almost felt my nose becoming runny and took out a tissue. When I tasted the dish, however, the taste wasn't nearly as sour as I expected it to be from the smell. So this fact, along with the fact that this occasion was my 3rd-year anniversary with my wife, probably makes this experience memorable to me.",cat10, Smell builds up and changes expectations,expecting,builds up expectations
"coffee beans. The coffee smell of a local coffee shop. The aroma of the beans are instantly present when you open the door. Once you walk in, the smell surrounds your body like a cologne. It makes the appeal of ordering the coffee even more delightful",cat10, Smell builds up and changes expectations,expecting,builds up expectations
"Book. When I was a kid, I got a new book. It smelled different than my school books, I smelled the pages of it and it smelled like an older world for some reason.l really liked the smell of the pages, it must have something o do with the paper material or how they assembled the book",cat10, Smell builds up and changes expectations,expecting,surprised me
"The Smell of Hungry Anticipation. I was trying a new soup for the first time. It was a rosemary and lentil soup. When it was brought to the table, the soft smell of rosemary immediately hit my nostrils. I love new food, and the blend of rosemary with a slightly beef-y broth made me antsy for the first bite. There was a smell of garlic that completed the fullness of the smell. It complimented the taste of the soup and built anticipation.",cat10, Smell builds up and changes expectations,expecting,builds up expectations
"My perfume experience. I purchased a new perfume online, without ever having smelled it before. There was a good chance that the smell could be undesirable, but I took my chances anyway. When it arrived and I opened it up, it was the best smelling perfume I had ever smelled. It was fresh and floral, but not overpowering. It has now become my favorite perfume.",cat10, Smell builds up and changes expectations,expecting,surprised me
"The Everlasting Apple Pie. One of my all time favorite smell experiences occurred in Stowe, VT. The smell was amazing as it came from the kitchen of my aunt's kitchen. The smell of homemade apple pie was so potent that I nearly drooled on the table. I smelt fresh apples, cinnamon, and crust.  The smell was so strong that it permeated throughout the house for days.  This was by far the best smell I have ever encountered.  I felt so happy that I was going to be able to eat this pie later on in the day.",cat10, Smell builds up and changes expectations,expecting,builds up expectations
"Aroma of the Beans. The first time I smelled my favorite coffee, I knew it would be the one that I enjoyed. I ground it myself in the grocery store and the aroma that blasted me in the nose was one of the best smells that I have experienced in my life.",cat10, Smell builds up and changes expectations,expecting,builds up expectations
Thanksgiving Day. I remember walking into my grandmothers house on Thanksgiving Day. She always had a huge table filled with all sorts of food including pies and turkey. The smell was so amazing and it gave me a good feeling inside knowing I would soon be enjoying all of these wonderful foods.,cat10, Smell builds up and changes expectations,expecting,builds up expectations
"cake smell. I woke up one morning to a wonderful smell, it turned out to be a birthday cake that my GF was baking for me. The pleasant smell was like a preview of what was to come. On that day I eventually had the best birthday ever.",cat10, Smell builds up and changes expectations,expecting,builds up expectations
"Sea Smell Let's You Know You are Close. I recently went to Avalon, New Jersey with some friends.  This is a relatively quiet shore town.  I could smell it when we started getting close.  It is a sort of marker.  When we are about 15 minutes from the shore you can smell sea salt and a sort of fishy but not in an unpleasant way type of smell.  It was exciting because we knew we were almost there.",cat10, Smell builds up and changes expectations,expecting,builds up expectations
"First Taste of Ambrosia. The first time my fiance made stroganoff for me. I was personally put off by it, because I'd had box stroganoff before and I'd never liked it. Then he began cooking it. I first started to smell the garlic, and I have to say, I'd never given garlic a second thought until that point. It was strong and fragrant and literally made my mouth water. He continued adding ingredients and the smell just seemed to grow and intensify. It made me really hungry.",cat10, Smell builds up and changes expectations,expecting,surprised me
"Is it a bakery or a house?. Going to my friends house for the first time, I expected it to be like any other home. Nothing out of the ordinary. But when I walked in, it smelled like a bakery. It was the best smell ever. His mom bakes all day long. Cookies, cakes, pies, anything. Its amazing that they're not even overweight. I love going there to this day, because right when you walk in, you smell good food, and get hungry.",cat10, Smell builds up and changes expectations,expecting,surprised me
"Christmas morning breakfast. Blueberry muffins baking on Christmas morning. Naturally as a child, I would wake up super early ready to open what Santa had brought me. I knew I couldn't do that without waking my parents, making muffins, and waiting on my family to get to my house. The smell of blueberry muffins reminds me of anticipation of my presents and annoyance because everyone was asking their sweet time.",cat10, Smell builds up and changes expectations,expecting,builds up expectations
"BBQ brought Steve and I together. I went with my brother in Reno to a new restaurant he had found. It was a BBq place and when we walked in I just knew it was the right place. You could smell the smoke, it was real. We had a great meal and a wonderful time together. It was one of the best times I have ever had with him.",cat10, Smell builds up and changes expectations,expecting,builds up expectations
"memorable smell. I remember when I read about a certain cologne in a magazine that I decided to try.  I was very excited about trying this particular cologne because of the excellent reviews it received.  I went to a department store that I frequently shop and buy all my colognes from.  I went to the sales person asked if they carried it and I was very pleased when I was told they have it in stock.  I asked if could smell it and the person handed me a tester.  I smelled the cologne and it was simply amazing!!  It really went beyond my expectations and I was pleased it smelled so unique.  It had a very fresh and clean scent to it,  and I felt refreshed and uplifted when I smelled it.  I bought the cologne and to this very day I still wear it.  That was 10 years ago.",cat10, Smell builds up and changes expectations,expecting,surprised me
"Bad Pumpkin. I was in elementary school and we were carving pumpkins. Well, it turns out my nose is not particularly fond of the smell of raw pumpkin. The exact minute the pumpkin was opened I got a whiff of the smell and ended puking as far as soon as it happened. I had to stay outside the classroom as the rest of the kids started carving up pumpkins, and from that day on I have never carved a pumpkin.",cat6, Overwhelming power of smell,hitting/shocking,traumatized me
"Mincemeat Pie: Ewww!. I was about 11 or 12 and my family was staying with friends on the other side of the state. I think it was a Sunday, and I woke up from sleeping on the couch. Nobody else was home, I think they had gone to church, and there was a terrible smell coming from the kitchen. I had no idea what it was, but I knew I had not smelled it before. It was a very pungent odor, and I felt like it was burning my nostrils. I could hardly even stand to go into the kitchen without becoming nauseous. When my parents came back I asked my Mom what the smell was and she said that her friend was making mincemeat pie. To this day I can't help but crinkle my nose up whenever I think about mincemeat pie.",cat6, Overwhelming power of smell,hitting/shocking,traumatized me
"Migraine from (Fragrance) Hell.. One day, my father used some cologne, way too much of it. About 20 minutes later, I had one of the worst migraines in my life. For some reason, a lot of fragrances give me headaches, and that particular migraine was the moment I decided to never attempt perfume ever again.",cat6, Overwhelming power of smell,hitting/shocking,traumatized me
"The Smell of Death. When I was 17, the person I was dating dies. He accidentally shot himself. I was in the room with him when it happened. I can still smell the coppery smell of his blood when I close my eyes. It has been over twenty years and it is still so clear in my mind.",cat6, Overwhelming power of smell,hitting/shocking,traumatized me
"Lemon Clorox Antibiotics. I was admitted into the hospital with an diverticulitis, a serious infection was running through my intestines.  They were trying to avoid surgery and kill the infection with antibiotics so they hooked me up, via IV, to 4 different very strong antibiotics.  It got to the point where I could smell the antibiotics coming out of my pours.  Every morning someone from housekeeping would come in and clean the floors and bathroom with lemon scented clorox.  This mixed with the antibiotics made me want to vomit.  To this day whenever I smell lemon scented clorox I almost puke.",cat6, Overwhelming power of smell,hitting/shocking,traumatized me
"Visit to a local county jail. As part of a research project, I visited a jail in a small county in Southern California, and this was my first time at a jail. My guide warned me ahead of the time that it was going to be a little foul in there, but nothing could have prepared me for the obscenely acrid stench of hundreds of men crammed into every available space of the jail, right down to windowless storage rooms converted into more cells. There was no air conditioning and it was a warm day in June, so the stink pervaded the place and seemed to envelop me and seep into my pores. For days afterwards, I couldn't shake the smell. It would come to me out of nowhere, more vivid than anything I had seen. There weren't enough showers to take it away. It's been several years since then, and my memory of that smell is just a strong as ever.",cat6, Overwhelming power of smell,hitting/shocking,traumatized me
"Shit really smell bad, very bad. I was once going out of town and there was a backward area in the way. When i was passing from that area i was passing from a bridge and under that bridge flowed all the shit of the people of that village. When we were crossing the bridge the smell of on that bridge was so disgusting and it was so intense that both me and the driver vomit on that smell and he became all right after the vomiting but for me that day was one of the worst days of my life and that smell was one of the worst. I vomited 3 times that day and i didn't ate anything that day and in my final vomit there were also some traces of blood so that smell really played a negative role in my life.",cat6, Overwhelming power of smell,hitting/shocking,traumatized me
"Cheese smell of death.. When I was younger my mom made this tuna casserole that I hated. There was always this smell associated with with it and I always associated it with  a disgusting dish. I had to sit through several of these meals and I don't think my mom understood how repulsed I am to scent. Later in life I discovered the smell came from a cheese used in the casserole. When I smelled the scent later I was stopped dead in my tracks, I refused to put the food in my mouth and I became nauseous.",cat6, Overwhelming power of smell,hitting/shocking,traumatized me
"Spearmint Memories. The first thing that comes to mind when I think of a memorable smell happened when I was in nursing school. Part of my Anatomy and Physiology class was obviously Anatomy lab. At Grand Canyon University, we were fortunate enough to be able to work with human cadavers instead of animal specimens. The smell of the dissection lab is one that I don't think anyone will ever forget. It doesn't smell like decay, it smells like formaldehyde mixed with some kind of spearmint like scent. I think they added that scent to make the formaldehyde less strong smelling, but in actuality I think it made it worse. To this day, anytime I smell spearmint, it takes me back to those days and makes me feel somewhat nauseous, even though I was never nauseous during dissection lab! I also don't like chewing spearmint gum or using toothpaste with spearmint flavoring because of it.",cat6, Overwhelming power of smell,hitting/shocking,traumatized me
"Paper Scent. I visited my brother when he lived in a small town that contained a paper mill.  This experience stands out to me because there was no getting away from the smell, nor did I become accustom to it during the course of my stay.  I am unsure how to describe the smell, I remember it being pretty unique.  There is not something that is easily compared to the smell of paper processing.",cat6, Overwhelming power of smell,hitting/shocking,overwhelmed me
"The smell of spoiled peas. My landlord canned some Mississippi Purple Hull peas about three years ago.  Last week, he gave my husband and myself many jars of vegetables that he had canned.  I gave some of the jars to my brother.  As we were going through the jars, we noticed that the tops had popped up on several of the jars.  I set these aside so we could throw the food away and wash and reuse the jars.  My husband and I planned to take the jars outside in case the food was spoiled.  We had the jars out beside the trash can to open them.  We opened the first one and the smell was horrible.  It was a combination of rotting flesh mixed with vomit.  The smell actually made me sick.  I will never forget this smell as long as I live.  The smell stayed in my nostrils for several hours, and was so bad that we could smell it inside the house even with the doors and windows shut.",cat6, Overwhelming power of smell,hitting/shocking,overwhelmed me
"Old People Stink. Walking into our local nursing home for the first time was awkward because it is such a nice building and they had told us it was full of nice old people. However, upon entering, our nostrils were assaulted with body odor and like something was rotting. Very unpleasant.",cat6, Overwhelming power of smell,hitting/shocking,overwhelmed me
"The Smell of Death and Dumps. I went to volunteer at a dump in Mexico where people were living.  I was with a team, and we went to visit people and deliver food.  The smell of the dump was so overwhelming.  It was more than just trash.  There were dead animals lying on the ground, and it just smelled like the worst thing I could ever imagine.  I felt so sick from the smell.  That had never happened to me before.  It was so disgusting.",cat6, Overwhelming power of smell,hitting/shocking,overwhelmed me
